{
  "design": "adpll_top",
  "pdk": "ics55",
  "target_mhz": 800,
  "ref_mhz": 100,
  "fcw": 8,
  "out_div": 1,
  "area": "medium",
  "mode": "buildable",
  "features": {
    "fractional": false,
    "wide_range": false,
    "low_jitter": false,
    "fast_lock": false,
    "allow_low_res": false
  },
  "structural": {
    "COARSE_NDELS": 15,
    "MID_NDELS": 15,
    "FINE_NDELS": 31,
    "IL_NDELS": 4,
    "FILTER_BITS": 16,
    "FCW_BITS": 8,
    "CNT_EXTRA_BITS": 8,
    "MEAS_PERIODS": 1
  },
  "allow_experimental": false,
  "allow_macro_rebuild": true,
  "require_identity": false
}
